Title (headline),Link,SEO Focus keyphrase,Categories (articleSection),Tags (keywords),Audience,Summary (description),Language,Notes
Predictive Modeling in Manufacturing: PLS vs PCA,https://www.dataparc.com/blog/predictive-modeling-in-manufacturing-pls-vs-pca/,predictive modeling in manufacturing,Data Visualization,Process Manufacturing,,"Predictive modeling in manufacturing is used to identify process issues before they occur - preventing unplanned downtime, reducing waste, &amp; improving efficiency.",English,
Deviation Analysis in Process Manufacturing,https://www.dataparc.com/blog/deviation-analysis-process-manufacturing/,deviation analysis,Data Visualization/Historian Data/Process Manufacturing/Troubleshooting & Analysis,,,"Deviation analysis is a routine form of troublehsooting performed at process manufacturing facilities around the world. When speed is imperative, a robust deviation detection system, along with a good process for analyzing the resulting data, is essential for solving problems quickly.",English,
Tech Terms Part II,https://www.dataparc.com/blog/tech-terms-part-ii/,,Process Manufacturing,Process Manufacturing,,,English,
Five Reasons You Should Attend The 2018 dataPARC User Conference,https://www.dataparc.com/blog/5-reasons-you-should-attend-the-2018-dataparc-user-conference/,,Process Manufacturing,Process Manufacturing,,,English,
Soft Sensors In The Process Industry,https://www.dataparc.com/blog/soft-sensors-in-the-process-industry/,soft sensors in the process industry,Process Manufacturing,Process Manufacturing,,,English,
Advantages Of A Plant-Wide Information System,https://www.dataparc.com/blog/advantages-plant-wide-information-system/,,Historian Data,Process Manufacturing,,,English,
What Makes A Great User Interface?,https://www.dataparc.com/blog/makes-great-user-interface/,,Data Visualization,Data Visualization,,,English,
The 2017 dataPARC User Conference Was A Networking And Learning Success Story,https://www.dataparc.com/blog/2017-dataparc-user-conference-networking-learning-success-story/,,Events,Data Visualization/Events/Process Manufacturing,,,English,
Version 5.5.2.1 – Get The Scoop On This Minor Release,https://www.dataparc.com/blog/version-5-5-2-2-get-scoop-changes/,,Process Manufacturing,Process Manufacturing,,,English,
Why We’re Implementing The OPC UA Spec. &#8211; And How It Will Benefit Our Customers,https://www.dataparc.com/blog/why-were-implementing-the-opc-ua-spec/,,News,News,,,English,
OPC UA: A Framework For The Industrial Internet of Things,https://www.dataparc.com/blog/opc-ua-enabling-the-industrial-internet-of-things/,,News,Process Manufacturing,,,English,
Using Process Displays For Troubleshooting,https://www.dataparc.com/blog/using-process-displays-for-troubleshooting/,using process displays for troubleshooting,Dashboards & Displays,Dashboards & Displays/Data Visualization/Process Manufacturing/Troubleshooting & Analysis,,"A lot of time and effort goes into the construction of the HMI screens and other display screens that are used to monitor and control production processes, so it is worth giving some time and thought to their layout and design. The most important consideration when using process displays for troubleshooting is how they can convey the most useful information in a timely manner to their intended audience.",English,
Convince Your Boss To Send You To PARCtraining: 4 Strategies That Will Work,https://www.dataparc.com/blog/convince-your-boss-to-send-you-to-parctraining-4-strategies-that-will-work/,,Training,Dashboards & Displays/Data Visualization/Process Manufacturing/Training/Troubleshooting & Analysis,,,English,
Benefits Of Calculated Variables In Process Manufacturing Analysis,https://www.dataparc.com/blog/benefits-of-calculated-variables-in-process-manufacturing-analysis/,calculated variables in process manufacturing,Process Manufacturing,Process Manufacturing,,,English,
"Static, Live Or Dynamic – Which Report Is Best?",https://www.dataparc.com/blog/static-live-dynamic-report-best/,,Process Manufacturing,Process Manufacturing,,,English,
Five Reasons You Should Attend dataPARC’s Virtual Conference,https://www.dataparc.com/blog/five-reasons-you-should-attend-dataparcs-virtual-conference/,,Events,,,,English,
Covid-19: How to Support Manufacturing Operations Remotely,https://www.dataparc.com/blog/covid-19-support-manufacturing-operations-remotely/,Remote Manufacturing,Dashboards & Displays/Data Visualization/News,,,Can the right set of tools support a realistic approach to overseeing remote manufacturing operations? Many companies are already relying on remote engineering support for their daily work to accomplish important company goals. Here are some of the overall challenges of remote manufacturing.,English,
Data Analysis Basics: Uncovering the Impact of Covid-19,https://www.dataparc.com/blog/data-analysis-basics-uncovering-impact-covid-19/,,Data Visualization,,,,English,
dataPARC &#8211; Intuitive Powerful and Connected,https://www.dataparc.com/blog/dataparc-intuitive-powerful-and-connected/,,Data Visualization,,,,English,
How To Get Your dataPARC Training Approved &#8211; Four Strategies That Will Work,https://www.dataparc.com/blog/how-to-get-your-dataparc-training-approved-four-strategies-that-will-work/,,Dashboards & Displays/Data Visualization/Process Manufacturing/Training,Data Visualization/Process Manufacturing,,,English,
2018 dataPARC User Conference – A Recap,https://www.dataparc.com/blog/2017-dataparc-user-conference-networking-learning-success-story-copy/,,Events,Data Visualization/Events/Process Manufacturing,,,English,
データヒストリアンにとって優れた可視化ソフトウェアとは?,https://www.dataparc.com/ja/blog/what-makes-good-visualization-software-for-data-historians/,データヒストリアンに対する可視化ソフトウェア,データの可視化,,,製造プロセスデータの保存と分析には、多くの様々なシステムを使用できます。その中の主なシステムがデータヒストリアンです。しかし、データヒストリアンにとって優れた可視化ソフトウェアとは何でしょうか。,Japanese,
品質管理でのパレートチャートの使用,https://www.dataparc.com/ja/blog/using-pareto-charts-for-quality-control/,,データ可視化／プロセス製造,,,,Japanese,
管理図を使用して製造品質を向上する方法,https://www.dataparc.com/ja/blog/how-to-use-control-charts-to-improve-manufacturing-quality/,管理図を使用して製造品質を向上する方法,データ可視化／プロセス製造,,,,Japanese,
プロセスエンジニアリングソフトウェア: 素晴らしく役に立つ13のツール,https://www.dataparc.com/ja/blog/process-engineering-software/,プロセスエンジニアリングソフトウェア,データ可視化／プロセス製造／トラブルシューティングと分析,,,プロセスエンジニアは、様々な理由で日々ソフトウェアを使用しています。この記事では、一般的なタイプのプロセスエンジニアリングソフトウェアを調査し、すべてのプロセスエンジニアが知っておくべき強力なソフトウェアアプリケーションにスポットを当てます。,Japanese,
データヒストリアン: 製造データの正しい保存先,https://www.dataparc.com/ja/blog/data-historian-still-the-right-choice-for-your-manufacturing-data/,データヒストリアン,ダッシュボード＆ディスプレイ/データ可視化/プロセス製造/トラブルシューティング＆分析,,,確立された運用データヒストリアンと最新のオープンソースプラットフォームは、どちらも立ち止まることなく進化してビジネスに新たな価値をもたらしていますが、データヒストリアンプラットフォームに現在組み込まれている専門領域の知識を見逃してはいけません。,Japanese,
Control Station and dataPARC Announce Partnership to Improve Data Utilization and Plant Efficiency,https://www.dataparc.com/blog/control-station-and-dataparc-announce-partnership/,Improve Data Utilization,Historian Data/News,,,"By integrating dataPARC&#039;s cutting-edge historian with Control Station&#039;s PlantESP Software, plants can now seamlessly improve data utilization.",English,
Human-Machine Interfaces For Process Industries,https://www.dataparc.com/blog/human-machine-interfaces-for-process-industries/,,Dashboards & Displays/Data Visualization/Process Manufacturing,Process Manufacturing,,,English,
Real-Time Gap Tracking Systems for Manufacturing,https://www.dataparc.com/blog/real-time-gap-tracking/,gap tracking,Dashboards & Displays/Data Visualization/Process Manufacturing/Troubleshooting & Analysis,,,Minimize manufacturing gaps such as operational cost or waste by performing a gap analysis with process data. In this article we will walk through the steps of a basic manufacturing gap analysis.,English,
Time-Series Database vs. Relational Database vs. Data Lake,https://www.dataparc.com/blog/time-series-database-vs-relational-database-vs-data-lake/,Time-Series Database vs. Relational Database vs. Data Lake,Dashboards & Displays/Data Visualization/Process Manufacturing/Troubleshooting & Analysis,,,"The most important differences between relational databases, time-series databases, and data lakes and other data sources are the ability to handle time-stamped process data and ensure data integrity.",English,
dataPARC Introduces AWS and Azure-Compatible Data Historian Platform for Advanced Industrial Applications and Cloud AI/ML Integration,https://www.dataparc.com/blog/dataparc-introduces-aws-and-azure-compatible-data-historian-platform-for-advanced-industrial-applications-and-cloud-ai-ml-integration/,,Historian Data/News,,,,English,
A Guide To Reporting And Notifications With A Data Historian,https://www.dataparc.com/blog/reporting-notifications-data-historian/,,Process Manufacturing,Process Manufacturing,,,English,
15 Manufacturing Acronyms You Should Know,https://www.dataparc.com/blog/15-manufacturing-acronyms-you-should-already-know/,Manufacturing Acronyms,Data Visualization/Process Manufacturing,Process Manufacturing,,"Manufacturing acronyms hold the key to streamlining processes, boosting efficiency, and staying competitive in the industry. So, whether you&#039;re a seasoned manufacturing pro or just starting your journey, mastering these manufacturing acronyms is a must.",English,
Benefits Of Calculated Variables,https://www.dataparc.com/blog/benefits-calculated-variables/,,Process Manufacturing,Process Manufacturing,,,English,
Developing Effective Manufacturing Operations Management Systems,https://www.dataparc.com/blog/developing-effective-manufacturing-operations-management-systems/,manufacturing operations management systems,Dashboards & Displays/Data Visualization/Process Manufacturing/Troubleshooting & Analysis,,,Manufacturing Operations Management systems provide manufacturers with a &quot;single source of truth&quot; by integrating the wide variety of tools and systems used to manage the production process from end-to-end.,English,
dataPARC Wins 2023 Breakthrough Product Award for its Cutting Edge Data Historian,https://www.dataparc.com/blog/2023-breakthrough-product-award/,,Historian Data/News,,,"dataPARC has been honored with the prestigious 2023 Breakthrough Product Award, as announced by Processing Magazine.",English,
流程制造业中的偏差分析,https://www.dataparc.com/zh/blog/deviation-analysis-process-manufacturing/,偏差分析,数据可视化/历史数据/流程制造/故障排除与分析,,,偏差分析是全球各地流程制造设施进行的一种常规故障排除形式。当速度至关重要时，强大的偏差检测系统以及对结果数据进行良好分析的流程对于快速解决问题至关重要。,Chinese,
制造业的能源管理：监测能耗,https://www.dataparc.com/zh/blog/energy-management-manufacturing-monitoring-consumption/,制造业的能源管理,流程制造,流程制造,,,Chinese,
공정 알람 관리 모범 사례,https://www.dataparc.com/ko/blog/best-practices-for-process-alarm-management/,공정 알람 관리,데이터 시각화,공정 제조,,적절한 공정 알람 관리는 신중한 계획이 필요하며 제어 시스템의 전반적인 효율성에 큰 영향을 미칩니다.,Korean,
过程报警管理最佳实践,https://www.dataparc.com/zh/blog/best-practices-for-process-alarm-management/,过程报警管理,数据可视化,流程制造,,恰当的过程报警管理需要仔细规划，对控制系统的整体效能有着重大影响。,Chinese,
데이터 히스토리안에 적합한 시각화 소프트웨어는 무엇일까요?,https://www.dataparc.com/ko/blog/what-makes-good-visualization-software-for-data-historians/,데이터 히스토리안을 위한 시각화 소프트웨어,데이터 시각화,공정 제조,,제조 공정 데이터를 저장하고 분석하기 위해 사용할 수 있는 다양한 시스템이 있습니다. 그중에서도 데이터 히스토리안은 가장 중요한 역할을 합니다. 데이터 히스토리안에 적합한 시각화 소프트웨어는 무엇일까요?,Korean,
什么构成了出色的数据历史记录系统可视化软件？,https://www.dataparc.com/zh/blog/what-makes-good-visualization-software-for-data-historians/,数据历史记录系统可视化软件,数据可视化,流程制造,,市场上有许多不同的系统可用于存储和分析制造过程数据，其中数据历史记录系统就是其中的佼佼者。那么，什么构成了出色的数据历史记录系统可视化软件？,Chinese,
如何使用控制图提升制造质量,https://www.dataparc.com/zh/blog/how-to-use-control-charts-to-improve-manufacturing-quality/,如何使用控制图提升制造质量,数据可视化/流程制造,流程制造,,深入软件与制造领域，学习如何借助控制图提升过程质量。,Chinese,
공정 엔지니어링 소프트웨어: 매우 유용한 13가지 도구,https://www.dataparc.com/ko/blog/process-engineering-software/,공정 계산 소프트웨어,데이터 시각화/프로세스 제조/문제 해결 및 분석,,,"공정 엔지니어는 매일 다양한 이유로 소프트웨어를 사용합니다. 이 글에서는 일반적인 공정 엔지니어링 소프트웨어 유형을 살펴보고, 모든 공정 엔지니어가 알아야 할 몇 가지 강력한 소프트웨어 애플리케이션을 소개합니다.",Korean,
데이터 히스토리안: 제조 데이터를 올바로 저장하는 방법,https://www.dataparc.com/ko/blog/data-historian-still-the-right-choice-for-your-manufacturing-data/,데이터 히스토리안,대시보드 및 디스플레이/데이터 시각화/프로세스 제조/문제 해결 및 분석,,,"기존의 운영 데이터 히스토리안과 새로운 오픈 소스 플랫폼 모두 계속 진화하면서 비즈니스에 새로운 가치를 창출하고 있지만, 현재 데이터 히스토리안 플랫폼에 내장된 전문 영역의 지식을 간과해서는 안 됩니다.",Korean,
"시계열 데이터베이스와 관계형 데이터베이스, 데이터 레이크의 비교",https://www.dataparc.com/ko/blog/time-series-database-vs-relational-database-vs-data-lake/,"시계열 데이터베이스와 관계형 데이터베이스, 데이터 레이크의 비교",대시보드 및 디스플레이/데이터 시각화/프로세스 제조/문제 해결 및 분석,,,"관계형 데이터베이스, 시계열 데이터베이스, 데이터 레이크 및 기타 데이터 소스 사이의 가장 중요한 차이점은 타임스탬프가 찍힌 공정 데이터를 처리하고 데이터 무결성을 보장하는 기능입니다.",Korean,
时间序列数据库与关系型数据库和数据湖对比,https://www.dataparc.com/zh/blog/time-series-database-vs-relational-database-vs-data-lake/,"시계열 데이터베이스와 관계형 데이터베이스, 데이터 레이크의 비교",仪表盘和显示器/数据可视化/流程制造/故障排除与分析,,,关系型数据库、时间序列数据库、数据湖与其他数据源之间最重要的区别在于处理带有时戳的工艺数据以及确保数据完整性的能力。,Chinese,
数据历史记录系统：仍然是您的制造数据的正确选择,https://www.dataparc.com/zh/blog/data-historian-still-the-right-choice-for-your-manufacturing-data/,数据历史记录系统,仪表盘和显示器/数据可视化/流程制造/故障排除和分析,,,无论是成熟的操作数据历史记录系统，还是新兴的开源平台，都在不断演进并为企业增添新的价值，但不应忽视如今已深深植根于数据历史记录系统平台中的专业知识。,Chinese,
过程工程软件：13 款超级实用工具,https://www.dataparc.com/zh/blog/process-engineering-software/,过程工程软件,数据可视化/流程制造/故障排除与分析,,,工艺工程师每天出于各种原因使用各类软件。本文将探讨常见的过程工程软件类型，并重点介绍每位工艺工程师应当了解的一些强大软件应用程序。,Chinese,
如何进行过程中心线化,https://www.dataparc.com/zh/blog/how-to-centerline-a-process/,如何进行过程中心线化,数据可视化/流程制造,流程制造,,了解如何使用不同工具和软件进行过程中心线化。,Chinese,
Process Alarm Management Best Practices,https://www.dataparc.com/blog/best-practices-for-process-alarm-management/,alarm management,Data Visualization,Process Manufacturing,,Learn how proper process alarm management requires careful planning and has a significant impact over control system effectiveness.,English,
Welcome To 5.5,https://www.dataparc.com/blog/welcome-to-5-5/,,Process Manufacturing,Process Manufacturing,,,English,
Introducing PARCview 5.4,https://www.dataparc.com/blog/introducing-parcview-5-4/,,News,Process Manufacturing,,,English,
Digital Transformation Roles and Responsibilities in Manufacturing,https://www.dataparc.com/blog/manufacturing-digital-transformation-roles-responsibilities/,digital transformation roles and responsibilities,Data Visualization/Historian Data/Process Manufacturing/Troubleshooting & Analysis,,,Explore key roles and responsibilities in digital transformation for manufacturing. Unlock your facility’s potential.,English,
ダウンタイム追跡: データの潜在能力を引き出す5つのステップ,https://www.dataparc.com/ja/blog/downtime-tracking-5-steps-to-harness-your-datas-potential/,ダウンタイムの追跡,プロセス製造,,,プロセスが稼働していない場合、製品を生産していないことになるので、機器のダウンタイムを追跡することは重要です。ダウンタイムデータを収集および追跡する際、有用な情報が生成されることを保証するためのこつを紹介します。,Japanese,
dataPARC Expands Operations in Latin America to Meet Growing Demand,https://www.dataparc.com/blog/dataparc-expands-operations-latin-america-meet-growing-demand/,,News/translate (en),,,,English,
공정 제조의 편차 분석,https://www.dataparc.com/ko/blog/deviation-analysis-process-manufacturing/,편차 분석,데이터 시각화/기록 데이터/공정 제조/문제 해결 및 분석,,,"편차 분석은 전 세계 공정 제조 시설에서 일상적으로 수행되는 일상적인 문제 해결 방식입니다. 속도가 중요한 경우, 문제를 신속하게 해결하려면 안정적인 편차 감지 시스템과 함께 결과 데이터를 분석하는 적절한 절차가 필수적입니다.",Korean,
공정 제조 분야의 디지털 트윈 솔루션,https://www.dataparc.com/ko/blog/digital-twin-solutions-process-manufacturing/,공정 제조의 디지털 트윈,공정 제조/분류되지 않음/공정 제조/분류되지 않음,,,공정 제조에서 디지털 트윈의 목표는 플랜트 작업자와 주제 전문가에게 문제 해결 및 작업 최적화를 위해 자산에 대한 모든 디지털 정보를 제공하는 것입니다.,Korean,
流程制造中的数字孪生解决方案,https://www.dataparc.com/zh/blog/digital-twin-solutions-process-manufacturing/,流程制造中的数字孪生,流程制造/未分类,,,在流程制造中，数字孪生的目标是为工厂操作员和专业领域专家提供有关资产的所有可用数字信息，以供故障排除和运营优化之用。,Chinese,
停机追踪：五步发挥数据潜力,https://www.dataparc.com/zh/blog/downtime-tracking-5-steps-to-harness-your-datas-potential/,停机追踪,流程制造,流程制造,,设备停机追踪至关重要，因为如果工艺不运行，就无法生产任何产品。在收集和追踪停机数据时，有几个关键点确保生成有用信息。,Chinese,
다운타임 추적: 데이터의 잠재력 활용을 위한 5단계,https://www.dataparc.com/ko/blog/downtime-tracking-5-steps-to-harness-your-datas-potential/,다운타임 추적,프로세스 제조,공정 제조,,공정이 가동되지 않으면 제품을 생산하지 않는 것이므로 장비 다운타임을 추적하는 것이 중요합니다. 다운타임 데이터를 수집하고 추적할 때 유용한 정보가 생성되도록 하기 위한 몇 가지 중요한 사항이 있습니다.,Korean,
품질 관리를 위한 파레토 차트 활용,https://www.dataparc.com/ko/blog/using-pareto-charts-for-quality-control/,,데이터 시각화/공정 제조,공정 제조,,,Korean,
使用帕雷托图进行质量控制,https://www.dataparc.com/zh/blog/using-pareto-charts-for-quality-control/,,数据可视化/流程制造,流程制造,,,Chinese,
제어 차트를 사용하여 제조 품질을 개선하는 방법,https://www.dataparc.com/ko/blog/how-to-use-control-charts-to-improve-manufacturing-quality/,제어 차트를 사용하여 제조 품질을 개선하는 방법,데이터 시각화/공정 제조,공정 제조,,제어 차트를 사용하여 공정에서 품질을 개선하는 방법을 배우면서 소프트웨어와 제조의 세계를 살펴보세요.,Korean,
공정 센터라인 설정 방법,https://www.dataparc.com/ko/blog/how-to-centerline-a-process/,공정 센터라인 설정 방법,데이터 시각화/공정 제조,공정 제조,,다양한 도구와 소프트웨어로 공정의 센터라인을 설정하는 방법을 알아보세요.,Korean,
寻找最佳选择：云数据历史数据库与本地部署数据历史记录系统之间的抉择,https://www.dataparc.com/zh/blog/choosing-between-cloud-and-on-premises-data-historians/,云数据历史记录系统,历史数据,,,对比云数据历史记录系统与本地部署数据历史记录系统。考察其对可扩展性、成本及安全性影响的优缺点。 ,Chinese,
적합한 솔루션 찾기: 클라우드 히스토리안과 온프레미스 데이터 히스토리안 중 선택하기,https://www.dataparc.com/ko/blog/choosing-between-cloud-and-on-premises-data-historians/,클라우드 데이터 히스토리안,역사가 데이터,,,"클라우드 데이터 히스토리안과 온프레미스 데이터 히스토리안을 비교하세요. 확장성, 비용, 보안에 미치는 영향에 따른 장단점도 살펴보세요. ",Korean,
流程工业中的数字化转型：5 个阶段,https://www.dataparc.com/zh/blog/digital-transformation-process-industries-5-stages/,流程工业中的数字化转型,仪表盘和显示器/数据可视化/流程制造/故障排除和分析,,,我们已确定流程工业中数字化转型的五个阶段。划分转型类别为定义每个客户面临的广泛挑战提供了框架，并为客户提供了最佳解决方案。它还有助于让客户全面了解我们能为客户做什么。或许您能在其中一个阶段中看到自己和您的工厂。,Chinese,
공정 산업의 디지털 혁신: 5단계,https://www.dataparc.com/ko/blog/digital-transformation-process-industries-5-stages/,공정 산업의 디지털 혁신,공정 제조/대시보드 및 디스플레이/데이터 시각화/문제 해결 및 분석,,,공정 산업에서 디지털 혁신을 위한 5가지 단계를 확인했습니다. 혁신의 범주를 지정하면 각 고객의 광범위한 과제를 정의하고 고객을 위한 최고의 솔루션을 제시할 수 있는 체계가 마련됩니다. 또한 고객에게 어떤 것이 가능한지 큰 그림으로 파악할 수 있도록 도움을 줍니다. 아마도 귀사와 귀사의 플랜트는 다음 단계 중 하나에 속해 있을 것입니다.,Korean,
借助环境数据软件优化 ESG 合规 ,https://www.dataparc.com/zh/blog/environmental-software-esg-compliance/,ESG 合规中的环境数据,仪表盘和显示器/数据可视化/流程制造,,,了解如何运用软件提升环境数据以符合 ESG 要求，通过创新软件解决方案简化报告与决策，助力可持续业务实践。,Chinese,
환경 데이터 소프트웨어를 통한 ESG 규정 준수 최적화 ,https://www.dataparc.com/ko/blog/environmental-software-esg-compliance/,ESG 규정 준수에서의 환경 데이터,대시보드 및 디스플레이/데이터 시각화/공정 제조,,,지속 가능한 비즈니스 활동을 위한 혁신적인 소프트웨어 솔루션으로 보고 및 의사결정을 간소화하여 ESG 규정 준수를 위한 환경 데이터를 개선하는 소프트웨어를 활용하는 방법을 알아보세요.,Korean,
Georgia-Pacific Selects dataPARC for Process Data Visualization and Analysis Across Containerboard and Cellulose Divisions,https://www.dataparc.com/blog/georgia-pacific-selects-dataparc-process-data-visualization-across-containerboard-cellulose-divisions/,,News,,,,English,
