Title (headline),Link,SEO Focus keyphrase,Categories (articleSection),Tags (keywords),Audience,Summary (description),Language,Notes
Optimizing ESG Compliance with Environmental Data Software ,https://www.dataparc.com/blog/environmental-software-esg-compliance/,Environmental Data in ESG Compliance,Dashboards & Displays/Data Visualization/Process Manufacturing,,,"Discover how to leverage software to enhance environmental data for ESG compliance, streamlining reporting and decision-making with innovative software solutions for sustainable business practices.",English,
ESG Data Analytics is a Game-Changer for Manufacturing,https://www.dataparc.com/blog/esg-data-analytics-game-changer/,esg data analytics,Dashboards & Displays/Data Visualization/Process Manufacturing,,,"In this blog post we will explore ESG data analytics, how it pertains to manufacturing and how innovative reporting tools enhance transparency and foster trust in ESG initiatives.",English,
Discussing FactoryTalk VantagePoint Replacements,https://www.dataparc.com/blog/discussing-factorytalk-vantagepoint-replacements/,VantagePoint Replacements,Data Visualization/Process Manufacturing/Troubleshooting & Analysis,,,"As the impending discontinuation date of Rockwell Automation&#039;s VantagePoint draws near, manufacturers find themselves presented with a unique opportunity for exploration and evaluation of VantagePoint replacements.",English,
Leverage Power BI Production Dashboards for Real-Time Insights,https://www.dataparc.com/blog/power-bi-production-dashboard/,Power BI Production Dashboards,Dashboards & Displays/Data Visualization/Process Manufacturing,,,Explore how process data can be incoprorated into Power BI production dashboards to give managment real-time inforamtion without waiting for monthly reports.,English,
ChatGPT for Engineers: Transforming Graphic Coding from Idea to Implementation,https://www.dataparc.com/blog/chatgpt-for-engineers/,ChatGPT for Engineers,Dashboards & Displays/Data Visualization/Process Manufacturing,,,"Explore how engineers can utilize ChatGPT for coding. Dive into the world of AI to create dynamic, user-friendly graphics.",English,
Replacing GE Digital&#8217;s Operations Hub: Exploring Innovative Alternatives,https://www.dataparc.com/blog/replacing-ge-digitals-operations-hub/,Replacing Operations Hub,Process Manufacturing,,,"In this blog, we&#039;ll explore the potential of replacing operations hub to find the best visualization tool for your site.",English,
Top Data Visualization Tools for aspenONE  Process Explorer Replacement,https://www.dataparc.com/blog/top-data-visualization-tools-for-aspenone-replacement/,aspenONE replacement,Process Manufacturing,,,Discover the future of data visualization in process industries as we explore various aspenONE replacement options.,English,
The Best Visualization Tool for Wonderware Historian,https://www.dataparc.com/blog/the-best-visualization-tool-for-wonderware-historian/,Wonderware Historian,Process Manufacturing,,,Learn about the seamless integration and exceptional visualization capabilities offered by dataPARC&#039;s PARCview with your Wonderware Historian.,English,
Find the Right Fit: Choosing Between Cloud and On-Premises Data Historians,https://www.dataparc.com/blog/choosing-between-cloud-and-on-premises-data-historians/,Cloud data historians,Historian Data,,,"Compare cloud and on-premises data historians. Examine benefits and drawbacks of their impact on scalability, cost, and security. ",English,
Exploring Alternatives to Honeywell Uniformance for Data Visualization,https://www.dataparc.com/blog/exploring-alternatives-to-honeywell-uniformance/,Honeywell Uniformance Alternatives,Data Visualization/Process Manufacturing/Troubleshooting & Analysis,,,"Find Honeywell Uniformance Alternatives by comparing essential factors like integration, visualization tools, and advanced analytics.",English,
Breaking Bottlenecks: Utilizing Maximum Sustainable Rate Analysis in Manufacturing,https://www.dataparc.com/blog/breaking-bottlenecks-utilizing-maximum-sustainable-rate-analysis-in-manufacturing/,Maximum Sustainable Rate,Process Manufacturing,,,"Dive into what Maximum Sustainable Rate (MSR) analysis is, why it&#039;s important, and how it can help find and eliminate bottlenecks.",English,
Best Time-Series Databases for Third-Party Applications ,https://www.dataparc.com/blog/best-time-series-databases-for-third-party-applications/,time series databases for third party applications,Historian Data,,,"In this article, we will compare several popular time series databases and evaluate their suitability for third-party applications.",English,
What to look for in a Data Historian for Third-Party Integration,https://www.dataparc.com/blog/what-to-look-for-in-data-historian-for-third-party-integration/,historian for third-party integration,Historian Data,,,Throughout this article we will explore what to look for when choosing a historian for third-party integration.,English,
Best Pi Vision Alternatives [2025],https://www.dataparc.com/blog/best-pi-vision-alternatives/,pi vision alternatives,Process Manufacturing,,,"In this post, we will take a closer look at PI Vision, share some insights provided by current PI Vision users, and highlight PI Vision alternatives that may offer better functionality and ease of use. ",English,
The Future of Manufacturing: Digital Transformation,https://www.dataparc.com/blog/the-future-of-manufacturing-digital-transformation/,Manufacturing Digital transformation,,,,"Digital transformation is changing the manufacturing industry. It enables companies to increase productivity, make data-driven decisions and increase efficiency. In this post, we will go over the benefits of digital transformation in manufacturing, some challenges manufacturers may face and best practices.  This post will provide a foundation for your digital transformation journey.",English,
Advanced Analytics in Manufacturing: How It Compares to Operational Analytics,https://www.dataparc.com/blog/advanced-analytics-vs-operational-analytics-in-manufacturing/,Advanced Analytics in manufacturing,Dashboards & Displays/Data Visualization/Process Manufacturing/Troubleshooting & Analysis,,,"Explore how advanced analytics in manufacturing compares to operational analytics, and learn their benefits, limitations, and applications.",English,
"Mastering Operational Reviews: a Guide to DORs, WORs, &#038; MORs",https://www.dataparc.com/blog/mastering-operational-reviews-guide-to-dors-wors-mors/,Operational Reviews,Dashboards & Displays/Data Visualization,,,"Reviewing operational data and KPIs are important for daily operation and communication up to management. By conducting routine operational reviews, you will know what goals are met and what areas need more focus.",English,
Building Effective Manufacturing KPI Dashboards and Reports,https://www.dataparc.com/blog/building-effective-manufacturing-kpi-dashboards-and-reports/,Manufacturing KPI Dashboards,Dashboards & Displays/Data Visualization,,,Explore how to build manufacturing KPI dashboards for targeted audiences. Learn hour to build dashboards that are clear and easy to read.,English,
제조 데이터용 산업 데이터 플랫폼의 중요성,https://www.dataparc.com/ko/blog/industrial-data-platform/,산업 데이터 플랫폼,번역 (ko)/공정 제조,데이터 시각화/공정 제조,,,Korean,
"실시간 제조 대시보드: 설정, 중요성, 이점",https://www.dataparc.com/ko/blog/real-time-manufacturing-dashboard-setup-importance-benefits/,실시간 제조 대시보드,translate (ko)/대시보드 및 디스플레이/데이터 시각화,,,,Korean,
dataPARC frente a PI,https://www.dataparc.com/es/blog/dataparc-vs-pi/,dataparc vs PI,Visualización de datos/Datos históricos/Fabricación de procesos/traducción(es)/Solución y análisis de problemas,,,,Spanish,
Monitoreo de energía industrial en la fabricación,https://www.dataparc.com/es/blog/energy-management-manufacturing-monitoring-consumption/,control de la energía industrial,Proceso de fabricación/traducción (es),Fabricación por procesos,,,Spanish,
5 formas efectivas de reducir el tiempo de inactividad en la fabricación,https://www.dataparc.com/es/blog/5-formas-efectivas-de-reducir-el-tiempo-de-inactividad-en-la-fabricacion/,reducir el tiempo de inactividad,Cuadros de mandos y visualizadores/Visualización de datos/Fabricación de procesos/traducción(es)/Solución de problemas y análisis,,,,Spanish,
Historiador de datos: Sigue siendo la opción correcta para sus datos de fabricación,https://www.dataparc.com/es/blog/historiador-de-datos-sigue-siendo-la-opcion-correcta-para-sus-datos-de-fabricacion/,Historiador de datos,Cuadros de mandos y visualizadores/Visualización de datos/Fabricación de procesos/traducción(es)/Solución de problemas y análisis,,,,Spanish,
Soluciones gemelas digitales en la fabricación de procesos,https://www.dataparc.com/es/blog/soluciones-gemelas-digitales-en-la-fabricacion-de-procesos/,gemelo digital industria de procesos,Proceso de fabricación/traducción (es)/Sin categoría,,,,Spanish,
Importancia de una plataforma de datos industrial para los datos de fabricación,https://www.dataparc.com/es/blog/industrial-data-platform/,plataformas de datos industriales,Proceso de fabricación/traducción (es),Visualización de datos/Fabricación de procesos,,,Spanish,
Encuentre el ajuste perfecto: Elección entre historiadores de datos en las instalaciones y en la nube,https://www.dataparc.com/es/blog/choosing-between-cloud-and-on-premises-data-historians/,Historiadores de datos en la nube,Historiador Datos/traducción (es),,,,Spanish,
3 principales alternativas de PI System para recopilar y visualizar datos,https://www.dataparc.com/es/blog/top-pi-system-alternatives/,Alternativas al sistema Pi,Visualización de datos/Datos históricos/Fabricación de procesos/traducción(es)/Solución y análisis de problemas,,,,Spanish,
Gestión de energía industrial: hacer un seguimiento del uso y la eficiencia de la ganancia,https://www.dataparc.com/es/blog/industrial-energy-management-track-usage-gain-efficiency/,Gestión de la energía industrial,Cuadros de mandos y visualizadores/Visualización de datos/Fabricación de procesos/traducción (es),,,,Spanish,
"Dashboards de fabricación en tiempo real: configuración, importancia y beneficios",https://www.dataparc.com/es/blog/real-time-manufacturing-dashboard-setup-importance-benefits/,cuadros de mando de fabricación en tiempo real,Cuadros de mando y visualizaciones/Visualización de datos/traducir (es),,,,Spanish,
Las mejores alternativas de PI Vision [2025],https://www.dataparc.com/es/blog/las-mejores-alternativas-de-pi-vision-2025/,alternativas de visión pi,Proceso de fabricación/traducción (es),,,,Spanish,
Las mejores alternativas de PI ProcessBook [2025],https://www.dataparc.com/es/blog/las-mejores-alternativas-de-pi-processbook-2025/,alternativas a processbook,Proceso de fabricación/traducción (es),,,,Spanish,
Cómo mejorar la eficiencia en la fabricación en 4 pasos,https://www.dataparc.com/es/blog/improve-manufacturing-efficiency/,cómo mejorar la eficiencia de la fabricación,Cuadros de mandos y visualizadores/Visualización de datos/Fabricación de procesos/traducción(es)/Solución de problemas y análisis,,,,Spanish,
¿Qué hace que un software de visualización sea bueno para los historiadores de datos?,https://www.dataparc.com/es/blog/que-hace-que-un-software-de-visualizacion-sea-bueno-para-los-historiadores-de-datos/,software de visualización para historiadores de datos,Visualización de datos/traducción (es),Fabricación por procesos,,,Spanish,
Industrielle Energieüberwachung in der Fertigung,https://www.dataparc.com/de/blog/energy-management-manufacturing-monitoring-consumption/,industrielle Energieüberwachung,Prozessfertigung/Übersetzen (de),Prozessfertigung,,,German,
Was macht eine gute Visualisierungs-Software für Daten-Historians aus?,https://www.dataparc.com/de/blog/what-makes-good-visualization-software-for-data-historians/,Visualisierungssoftware für Datenhistoriker,Datenvisualisierung/Übersetzen (de),Prozessfertigung,,,German,
5 Effektive Möglichkeiten zur Reduzierung von Ausfallzeiten in der Fertigung,https://www.dataparc.com/de/blog/5-effective-ways-to-reduce-downtime-in-manufacturing/,Ausfallzeiten reduzieren,Dashboards & Anzeigen/Datenvisualisierung/Prozessherstellung/Übersetzen (de)/Fehlerbehebung & Analyse,,,,German,
Daten-Historian: Immer noch die richtige Wahl für Ihre Fertigungsdaten,https://www.dataparc.com/de/blog/data-historian-still-the-right-choice-for-your-manufacturing-data/,Datenhistoriker,Dashboards & Anzeigen/Datenvisualisierung/Prozessherstellung/Übersetzen (de)/Fehlerbehebung & Analyse,,,,German,
Digitaler-Zwilling-Lösungen in der Prozessfertigung,https://www.dataparc.com/de/blog/digital-twin-solutions-in-process-manufacturing/,digitaler Zwilling Prozessindustrie,Prozessfertigung/Übersetzen (de)/Uncategorized,,,,German,
Bedeutung einer industriellen Datenplattform für Fertigungsdaten,https://www.dataparc.com/de/blog/industrial-data-platform/,industrielle Datenplattformen,Prozessfertigung/Übersetzen (de),Datenvisualisierung/Prozessfertigung,,,German,
Finden Sie die richtige Lösung: Die Wahl zwischen Cloud- und Vor-Ort-Daten-Historians,https://www.dataparc.com/de/blog/choosing-between-cloud-and-on-premises-data-historians/,Cloud-Datenhistoriker,Historiker Daten/Übersetzen (de),,,,German,
3 Führende Alternativen für das PI System zum Erfassen und Visualisieren von Daten,https://www.dataparc.com/de/blog/top-pi-system-alternatives/,Pi-System-Alternativen,Datenvisualisierung/Historische Daten/Prozessherstellung/Übersetzen (de)/Fehlerbehebung & Analyse,,,,German,
Industrielles Energiemanagement: Nutzung verfolgen und Effizienz gewinnen,https://www.dataparc.com/de/blog/industrial-energy-management-track-usage-gain-efficiency/,Industrielles Energiemanagement,Dashboards & Displays/Datenvisualisierung/Prozessfertigung/übersetzen (de),,,,German,
"Echtzeit-Dashboards für die Fertigung: Einrichtung, Bedeutung und Vorteile",https://www.dataparc.com/de/blog/real-time-manufacturing-dashboard-setup-importance-benefits/,Dashboards für die Fertigung in Echtzeit,Armaturenbretter & Anzeigen/Datenvisualisierung/übersetzen (de),,,,German,
Beste Alternativen für PI Vision [2025],https://www.dataparc.com/de/blog/best-pi-vision-alternatives-2025/,pi vision Alternativen,Prozessfertigung/Übersetzen (de),,,,German,
Verbesserung der Fertigungseffizienz in 4 Schritten,https://www.dataparc.com/de/blog/improve-manufacturing-efficiency/,wie die Effizienz der Produktion verbessert werden kann,Dashboards & Anzeigen/Datenvisualisierung/Prozessherstellung/Übersetzen (de)/Fehlerbehebung & Analyse,,,,German,
Beste Alternativen für PI ProcessBook [2025],https://www.dataparc.com/de/blog/best-pi-processbook-alternatives-2025/,Prozessbuch-Alternativen,Prozessfertigung/Übersetzen (de),,,,German,
dataPARC vs PI,https://www.dataparc.com/de/blog/dataparc-vs-pi/,dataparc vs PI,Datenvisualisierung/Historische Daten/Prozessherstellung/Übersetzen (de)/Fehlerbehebung & Analyse,,,,German,
5 maneiras eficazes de reduzir o tempo de inatividade na manufatura,https://www.dataparc.com/pt/blog/5-maneiras-eficazes-de-reduzir-o-tempo-de-inatividade-na-manufatura/,reduzir o tempo de inatividade,Dashboards & Displays/Data Visualization/Process Manufacturing/translate (pt)/Troubleshooting & Analysis,,,,Portuguese,
Historiadores de Dados: Ainda a escolha certa para seus dados de fabricação,https://www.dataparc.com/pt/blog/historiadores-de-dados-ainda-a-escolha-certa-para-seus-dados-de-fabricacao/,Historiador de dados,Dashboards & Displays/Data Visualization/Process Manufacturing/translate (pt)/Troubleshooting & Analysis,,,,Portuguese,
3 principais alternativas ao PI System para coletar e visualizar dados,https://www.dataparc.com/pt/blog/top-pi-system-alternatives/,Alternativas ao sistema Pi,Visualização de dados/Dados do historiador/Fabricação de processos/Translate (pt)/Troubleshooting & Analysis,,,,Portuguese,
Melhores alternativas ao PI Vision [2025],https://www.dataparc.com/pt/blog/melhores-alternativas-ao-pi-vision-2025/,alternativas de visão pi,Manufatura de processos/traduzir (pt),,,,Portuguese,
Melhores Alternativas do PI ProcessBook [2025],https://www.dataparc.com/pt/blog/melhores-alternativas-do-pi-processbook-2025/,alternativas ao processbook,Manufatura de processos/tradução (pt),,,,Portuguese,
O que torna um bom software de visualização para historiadores de dados?,https://www.dataparc.com/pt/blog/o-que-torna-um-bom-software-de-visualizacao-para-historiadores-de-dados/,software de visualização para historiadores de dados,Visualização de dados/tradução (pt),Manufatura de processos,,,Portuguese,
Monitoramento de energia industrial na fabricação,https://www.dataparc.com/pt/blog/energy-management-manufacturing-monitoring-consumption/,monitoramento de energia industrial,Manufatura de processos/traduzir (pt),Fabricação de processos,,,Portuguese,
Soluções de gêmeos digitais na fabricação de processos,https://www.dataparc.com/pt/blog/solucoes-de-gemeos-digitais-na-fabricacao-de-processos/,indústria de processos de gêmeos digitais,Fabricação de processos/tradução (pt)/Uncategorized,,,,Portuguese,
Importância de uma plataforma de dados industriais para dados de manufatura,https://www.dataparc.com/pt/blog/industrial-data-platform/,plataformas de dados industriais,Fabricação de processos/tradução (pt),Visualização de dados/manufatura de processos,,,Portuguese,
Encontre o ajuste certo: Escolhendo entre historiadores de dados na nuvem e no local,https://www.dataparc.com/pt/blog/choosing-between-cloud-and-on-premises-data-historians/,Historiadores de dados em nuvem,Historiador de dados/traduzir (pt),,,,Portuguese,
Gerenciamento de Energia Industrial: Acompanhe o Uso e Ganhe Eficiência,https://www.dataparc.com/pt/blog/industrial-energy-management-track-usage-gain-efficiency/,Gerenciamento de energia industrial,Painéis e exibições/Visualização de dados/Manufatura de processos/traduzir,,,,Portuguese,
"Painéis de fabricação em tempo real: Configuração, importância e benefícios",https://www.dataparc.com/pt/blog/real-time-manufacturing-dashboard-setup-importance-benefits/,Painéis de manufatura em tempo real,Dashboards & Displays/Data Visualization/translate (pt),,,,Portuguese,
Como melhorar a eficiência da fabricação em 4 etapas,https://www.dataparc.com/pt/blog/improve-manufacturing-efficiency/,como melhorar a eficiência da manufatura,Dashboards & Displays/Data Visualization/Process Manufacturing/translate (pt)/Troubleshooting & Analysis,,,,Portuguese,
dataPARC vs PI,https://www.dataparc.com/pt/blog/dataparc-vs-pi/,dataparc vs PI,Data Visualization/Historian Data/Process Manufacturing/translate (pt)/Troubleshooting & Analysis,,,,Portuguese,
Unified Namespace (UNS) Explained: A Key to Industrial Data Visibility,https://www.dataparc.com/blog/unified-namespace-explained-a-key-to-industrial-data-visibility/,Unified Namespace,Data Visualization/Process Manufacturing,,,"Discover how a Unified Namespace (UNS) eliminates data silos in manufacturing by creating a real-time, structured source of truth.",English,
Yokogawa Exaquantum Alternative for Effective Data Management,https://www.dataparc.com/blog/yokogawa-exaquantum-alternative-for-data-management/,Yokogawa Exaquantum Alternative,Process Manufacturing,,,"Looking for a Yokogawa Exaquantum alternative? Learn what to look for and our recommendations for better scalability, security, and real-time insights to optimize your operations",English,
データの収集と可視化のためのPI System代替ツール、トップ3,https://www.dataparc.com/ja/blog/top-pi-system-alternatives/,,データ可視化/ヒストリアンデータ/プロセス製造/翻訳(ja)/トラブルシューティング＆分析,,,,Japanese,
自社のデータヒストリアンにぴったりのアプローチを見つける: クラウド型かオンプレミス型か,https://www.dataparc.com/ja/blog/choosing-between-cloud-and-on-premises-data-historians/,クラウドデータヒストリアン,ヒストリアン・データ/翻訳 (ja),,,,Japanese,
製造効率を上げる4つのステップ,https://www.dataparc.com/ja/blog/improve-manufacturing-efficiency/,製造効率を高める方法,ダッシュボード＆ディスプレイ/データ可視化/プロセス製造/翻訳(ja)/トラブルシューティング＆分析,,,,Japanese,
製造データのための産業用データプラットフォームの重要性,https://www.dataparc.com/ja/blog/industrial-data-platform/,産業用データプラットフォーム,プロセス製造/翻訳 (ja),データ可視化／プロセス製造,,,Japanese,
OEEデータ収集ソフトウェア: 無駄を減らし、効率を高める,https://www.dataparc.com/ja/blog/oee-data-collection-software-reduce-waste-increase-efficiency/,OEEデータ収集ソフトウェア,プロセス製造,,,,Japanese,
製造における産業用エネルギーの監視,https://www.dataparc.com/ja/blog/energy-management-manufacturing-monitoring-consumption/,産業用エネルギー監視,プロセス製造/翻訳 (ja),プロセス製造,,,Japanese,
リアルタイム製造ダッシュボード: 導入、重要性、メリット,https://www.dataparc.com/ja/blog/real-time-manufacturing-dashboards-setup-importance-and-benefits/,リアルタイム製造ダッシュボード,ダッシュボード＆ディスプレイ／データの可視化,,,,Japanese,
プロセス製造におけるデジタルツインソリューション,https://www.dataparc.com/ja/blog/digital-twin-solutions-process-manufacturing/,デジタル・ツイン・プロセス産業,プロセス製造/翻訳 (ja) /未分類,,,,Japanese,
dataPARC Recognized as a Top Work Place 2025,https://www.dataparc.com/blog/dataparc-recognized-as-top-work-place/,dataPARC Top Work Place,News,,,"dataPARC has been recognized as a top workplace in Engineering.com&#039;s workplace survey, earning a 93% overall workplace experience score.",English,
3 Key Benefits Of Plant Information Management Systems (PIMS),https://www.dataparc.com/blog/3-key-benefits-of-plant-information-management-systems-pims/,plant information management systems,Data Visualization/Process Manufacturing,Process Manufacturing,,"Discover how plant information management systems help manufacturers improve data visibility, streamline operations, and make data-driven decisions.",English,
Unified Namespace Software: Tools Manufacturers Use to Connect IT &amp; OT,https://www.dataparc.com/blog/unified-namespace-software-tools-to-connect-it-and-ot/,Unified Namespace Software,Data Visualization/Process Manufacturing,,,Explore unified namespace software for manufacturing and learn how tools like dataPARC help connect IT and OT systems for real-time data visibility.,English,
