Title (headline),Link,SEO Focus keyphrase,Categories (articleSection),Tags (keywords),Audience,Summary (description),Language,Notes
Downtime Tracking: 5 Steps To Harness Your Data’s Potential,https://www.dataparc.com/blog/downtime-tracking-5-steps-to-harness-your-datas-potential/,downtime tracking,Process Manufacturing,Process Manufacturing,,"Equipment downtime tracking is important because if the process isn’t running, you aren’t producing any product. Here’s how to harness your data.",English,
How to Calculate OEE: Formulas For Peak Performance,https://www.dataparc.com/blog/calculating-oee-formulas-for-peak-performance/,OEE calculation formula,Data Visualization/Process Manufacturing,Process Manufacturing,,"OEE combines downtime, speed, and quality losses into one value. Here’s the OEE calculation formula and everything else you need to know.",English,
Implementing OEE: 6 Keys to Success,https://www.dataparc.com/blog/6-keys-to-successful-oee-implementation/,implementing oee,Data Visualization/Process Manufacturing,Process Manufacturing,,OEE is not a one stope shop. In this article we will explore methods of implementing oee for improved performance.,English,
Rethinking Data Compression For Process Historians,https://www.dataparc.com/blog/rethinking-data-compression-for-process-historians/,data compression for process historians,Process Manufacturing,Process Manufacturing,,,English,
Digital Twin Solutions in Process Manufacturing,https://www.dataparc.com/blog/digital-twin-solutions-process-manufacturing/,digital twin process industry,Process Manufacturing,,,Learn how digital twins optimize process manufacturing by providing real-time data for troubleshooting and operations efficiency.,English,
Using Pareto Charts For Quality Control,https://www.dataparc.com/blog/using-pareto-charts-for-quality-control/,pareto,Data Visualization/Process Manufacturing,Process Manufacturing,,,English,
Anomaly Detection for Time Series Data,https://www.dataparc.com/blog/time-series-anomaly-detection-manufacturing-process/,anomaly detection in time series,Data Visualization/Historian Data/Process Manufacturing/Troubleshooting & Analysis,,,Discover how time series anomaly detection helps manufacturing identify and resolve issues quickly with effective methods and tools for process control.,English,
HMI Design Best Practices: The Complete Guide,https://www.dataparc.com/blog/hmi-design-best-practices-complete-guide/,HMI Design Best Practices,Dashboards & Displays/Data Visualization/Process Manufacturing,Process Manufacturing,,,English,
How To Centerline A Process,https://www.dataparc.com/blog/how-to-centerline-a-process/,how to centerline a process,Data Visualization/Process Manufacturing,Process Manufacturing,,Learn how to centerline a process with different tools and software.,English,
13 Essential Manufacturing KPIs for Continuous Improvement,https://www.dataparc.com/blog/establishing-manufacturing-kpis-for-continuous-improvement/,Manufacturing KPIs,Dashboards & Displays/Data Visualization,,,"KPIs are a powerful tool for manufacturers to drive continuous improvement and promote process efficiency. We’ll explain what KPIs are, how they are used in manufacturing and tie into continuous improvement. Feel confident in selecting and developing KPIs with a step-by-step outline.",English,
How to Implement 5 Whys Root Cause Analysis in Manufacturing,https://www.dataparc.com/blog/how-to-implement-5-whys-root-cause-analysis-process-manufacturing/,5 Why Root Cause Analysis,Process Manufacturing/Troubleshooting & Analysis,,,Learn how to apply the 5 Whys Root Cause Analysis method to uncover and solve manufacturing issues effectively with this step-by-step guide.,English,
How to Perform a Manufacturing Gap Analysis,https://www.dataparc.com/blog/how-to-perform-manufacturing-gap-analysis/,manufacturing gap analysis,Dashboards & Displays/Data Visualization/Process Manufacturing/Troubleshooting & Analysis,,,Minimize manufacturing gaps such as operational cost or waste by performing a gap analysis with process data. In this article we will walk through the steps of a basic manufacturing gap analysis.,English,
Process Engineering Software: 13 Super Useful Tools,https://www.dataparc.com/blog/process-engineering-software/,process engineering software,Data Visualization/Process Manufacturing/Troubleshooting & Analysis,,,Process engineers use software every day for a variety of reasons. In this article we will explore common types of process engineering software and highlight some powerful software applications that every process engineer should know.,English,
7 Strategies to Improves OEE While Analyzing the 6 Big Losses,https://www.dataparc.com/blog/improving-oee-analyzing-six-big-losses/,improve oee,Process Manufacturing,Process Manufacturing,,"Discover effective strategies to improve OEE: optimize maintenance, streamline processes, and reduce both planned and unplanned downtime.",English,
Control Charts in Manufacturing Quality Control,https://www.dataparc.com/blog/how-to-use-control-charts-to-improve-manufacturing-quality/,control chart in quality control,Data Visualization/Process Manufacturing,Process Manufacturing,,Learn how to use control charts in quality control to enhance your manufacturing processes and improve quality.,English,
"Process Control Loops: Trending PV, SP, OP And Mode",https://www.dataparc.com/blog/process-control-loops-trending-pv-sp-op-and-mode/,process control loops,Process Manufacturing,Process Manufacturing,,,English,
Data Historian Reporting Best Practices,https://www.dataparc.com/blog/data-historian-reporting-best-practices/,,Process Manufacturing,Process Manufacturing,,,English,
Tech Terms Today – What The Buzzword Was That?,https://www.dataparc.com/blog/tech-terms-today-what-the-buzzword-was-that/,,Process Manufacturing,Process Manufacturing,,,English,
IT/OT Convergence in Manufacturing,https://www.dataparc.com/blog/it-ot-convergence-in-manufacturing-easier-than-you-think/,IT OT Convergence in Manufacturing,Process Manufacturing,,,"Learn how IT/OT convergence in manufacturing can be simplified with strategic tools and gradual changes, improving efficiency and reducing costs.",English,
Stages of Digital Transformation in the Process Industry,https://www.dataparc.com/blog/digital-transformation-process-industries-5-stages/,stages of digital transformation,Dashboards & Displays/Data Visualization/Process Manufacturing/Troubleshooting & Analysis,,,"Discover the 5 key stages of digital transformation in process industries, from awareness to full integration, to boost efficiency and innovation.",English,
Data Historian: Still The Right Choice For Your Manufacturing Data,https://www.dataparc.com/blog/data-historian-still-the-right-choice-for-your-manufacturing-data/,Data Historian,Dashboards & Displays/Data Visualization/Process Manufacturing/Troubleshooting & Analysis,,,"Both established operational data historians and newer open-source platforms continue to evolve and add new value to business, but the significant domain expertise now embedded within data historian platforms should not be overlooked.",English,
Unlocking Better Process Display Performance Using WPF and XAML,https://www.dataparc.com/blog/secret-better-process-display-performance-hint-wpf-xaml/,,Process Manufacturing,Dashboards & Displays/Process Manufacturing,,,English,
Aggregating Manufacturing Data for Accurate Analysis,https://www.dataparc.com/blog/aggregate-manufacturing-data-accurate-analysis/,aggregating manufacturing data,Process Manufacturing,Process Manufacturing,,"The first step toward understanding and optimizing a manufacturing process is to collect and archive data about the process. Ideally, the system used for aggregating manufacturing data is a &quot;plant wide&quot; information system, or PIMS, which collects not just process data, but also quality information and laboratory results, and operations information such as upcoming orders and inventory.",English,
Manufacturing KPI Formulas: Examples to Measure Manufacturing &amp; Production Efficiency,https://www.dataparc.com/blog/manufacturing-kpi-formulas/,aggregating manufacturing data,Process Manufacturing,,,Discover 10 essential KPI formulas to measure success in manufacturing. Optimize operations and drive growth with these proven performance indicators.,English,
Integrating Manufacturing Data: 6 Combos for Process Analysis,https://www.dataparc.com/blog/integrating-manufacturing-data-6-combos-for-process-analysis/,integrating manufacturing data,Data Visualization/Historian Data/Process Manufacturing/Troubleshooting & Analysis,,,"Integrating manufacturing data in a plant is necessary for many reasons. Among the most important is getting relevant data to various departments quickly. In doing so, downtime is reduced, anomalies are identified and corrected, and quality is improved. In this article we will walk you through the different integrations and what to look out for as well as tips and best practices.",English,
"dataPARC Unveils Browser-Based Version of PARCview, Extending Process Data Visualization and Analysis Across Devices ",https://www.dataparc.com/blog/dataparc-unveils-browser-based-version-of-parcview/,,News,,,,English,
Getting “High Performance” Process Data From Your PIMS,https://www.dataparc.com/blog/getting-high-performance-process-data-pims/,High Performance from your PIMS,Process Manufacturing,Process Manufacturing,,Check out how to optimize your data to increase performance to trend your data and get answers at the speed of thought.,English,
Easily Integrating Maintenance Information With A Computerized Maintenance Management System (CMMS),https://www.dataparc.com/blog/easily-integrating-maintenance-information-with-a-computerized-maintenance-management-system-cmms/,Easily Integrating Maintenance Information With A Computerized Maintenance Management System (CMMS),Data Visualization,Process Manufacturing,,,English,
PI Visionに代わる最良のツール [2025],https://www.dataparc.com/ja/blog/best-pi-vision-alternatives/,PI Visionの代替ツール,プロセス製造,,,この記事では、PI Visionを詳細に調べて、現在のPI Visionユーザーから提供されたいくつかの洞察を共有し、より良い機能と使いやすさを提供する可能性がある、PI Visionに代わるツールに注目します。,Japanese,
最佳 Pi Vision 替代方案 [2025］,https://www.dataparc.com/zh/blog/best-pi-vision-alternatives-2024/,PI Vsion 替代方案,流程制造,,,在本帖中，我们将深入探讨 PI Vision，分享当前 PI Vision 用户的一些见解，并突出可能在功能和易用性上更胜一筹的 PI Vision 替代方案。 ,Chinese,
최고의 PI Vision 대안 [2025],https://www.dataparc.com/ko/blog/best-pi-vision-alternatives-2024/,PI 비전 대안,프로세스 제조,,,"이번 게시물에서는 PI Vision을 자세히 살펴보고, 현재 PI Vision 사용자가 제공한 몇 가지 의견을 공유하며, 더 나은 기능과 사용 편의성을 제공하는 PI Vision의 대안을 소개합니다.",Korean,
최고의 PI ProcessBook 대안 [2025],https://www.dataparc.com/ko/blog/best-pi-processbook-alternatives-2024/,프로세스북 대안,공정 제조,,,"PI ProcessBook의 지원 종료가 임박한 지금, 공정 업계의 많은 엔지니어와 작업자는 수년간 의존해 온 도구를 교체해야 하는 과제에 직면해 있습니다. 이 글에서는 ProcessBook 대체 도구를 평가하기 위한 몇 가지 팁을 제공하고, 현재 사용 가능한 최고의 ProcessBook 대안을 소개합니다.",Korean,
最佳 Pi ProcessBook 替代品 [2025］,https://www.dataparc.com/zh/blog/best-pi-processbook-alternatives-2024/,processbook 替代方案,流程制造,,,随着 PI ProcessBook 走向淘汰，许多流程制造商面临替换多年来依赖的工具的挑战。在本文中，我们将为您提供一些评估当今可用的最佳 ProcessBook 替代方案的技巧。,Chinese,
PI ProcessBookに代わる最良のツール [2025],https://www.dataparc.com/ja/blog/best-pi-processbook-alternatives/,ProcessBookの代替ツール,プロセス製造,,,PI ProcessBookが消滅に向かっている今、多くのプロセスメーカーは、長年依存してきたツールを置換するという課題に直面しています。この記事では、現在入手可能な最も優れたProcessBookの代替ツールの評価に関するヒントを示します。,Japanese,
Best Pi ProcessBook Alternatives [2025],https://www.dataparc.com/blog/best-pi-processbook-alternatives/,processbook alternatives,Process Manufacturing,,,"Now that PI ProcessBook is headed toward extinction, many process manufacturers are presented with the challenge of replacing the tools they’ve depended on for years. In this article we’ll give you some tips for evaluating some of the best ProcessBook alternatives available today.",English,
What Makes Good Visualization Software For Data Historians?,https://www.dataparc.com/blog/what-makes-good-visualization-software-for-data-historians/,visualization software for data historians,Data Visualization,Process Manufacturing,,There are many different systems available for storing and analyzing manufacturing process data. A data historian is chief among these. But what makes good visualization software for data historians?,English,
製造業でダウンタイムを削減する5つの効果的な方法,https://www.dataparc.com/ja/blog/5-effective-ways-to-reduce-downtime-in-manufacturing/,ダウンタイムの削減,ダッシュボード＆ディスプレイ/データ可視化/プロセス製造/トラブルシューティング＆分析,,,ダウンタイムの削減により、生産性の向上、コストの削減、および事故の減少が実現します。ダウンタイム追跡ソフトウェアを使用すると、ダウンタイム削減に役立ちます。プロセスがダウンしている理由を知ることは、ダウンタイム削減の鍵になります。,Japanese,
dataPARC와 PI의 비교,https://www.dataparc.com/ko/blog/dataparc-vs-pi/,dataPARC와 PI의 비교,데이터 시각화/기록 데이터/공정 제조/문제 해결 및 분석,,,"공정 산업에서 최적화는 효율성의 핵심입니다. 그리고 효율성은 제조업체가 더 많이 생산하고 낭비를 줄임으로써 수익을 창출할 수 있게 해 줍니다. 공정 최적화를 위해 많은 제조업체는 시계열 데이터 히스토리안과 데이터 시각화 소프트웨어를 함께 사용합니다. 이 글에서는 이 분야의 선두주자인 dataPARC와 PI를 비교하고, 공정 정보 관리 시스템으로서 dataPARC가 PI보다 뛰어난 몇 가지 장점을 강조할 것입니다.",Korean,
dataPARC 与 PI 对比,https://www.dataparc.com/zh/blog/dataparc-vs-pi/,dataPARC 与 PI 对比,数据可视化/历史数据/流程制造/故障排除与分析,,,在流程工业中，优化是提高效率的关键，而效率正是带来利润的源泉，使制造商能够生产更多，浪费更少。为了优化其流程，许多制造商将时间序列数据历史记录系统和数据可视化软件结合使用。这些工具对于工艺、环境和质量监测至关重要。dataPARC 和 PI 是流程数据分析领域的两大领军者，在本文中，我们将比较 dataPARC 与 PI，并重点介绍 dataPARC 作为过程信息管理系统相对于 PI 的一些优势。,Chinese,
dataPARCとPIの比較,https://www.dataparc.com/ja/blog/dataparc-vs-pi/,dataPARCとPIの比較,データの可視化/ヒストリアンデータ/プロセス製造/トラブルシューティングと分析,,,プロセス産業では、最適化が効率性の鍵となります。そして、効率性は利益につながり、メーカーは生産を増やし、無駄を削減できます。プロセスを最適化するために、多くのメーカーは時系列データヒストリアンとデータ可視化ソフトウェアを組み合わせています。これらのツールは、プロセス、環境、および品質の監視に不可欠です。dataPARCとPIはプロセスデータ分析分野をリードする2つの製品であり、この記事ではdataPARCとPIを比較して、プロセス情報管理システムとしてdataPARCがPIよりも優れている点をいくつか紹介します。,Japanese,
dataPARC vs PI,https://www.dataparc.com/blog/dataparc-vs-pi/,dataparc vs PI,Data Visualization/Historian Data/Process Manufacturing/Troubleshooting & Analysis,,,"In the process industries, optimization is the key to efficiency. And efficiency is what leads to profit - allowing manufacturers to produce more and waste less. To optimize their processes, many manufactures pair time series data historian and data visualization software. These tools are vital for process, environmental and quality monitoring. dataPARC and PI are two of the leaders in the process data analytics space, and in this article we&#039;ll compare dataPARC vs PI and highight some of the advantages dataPARC has over PI as a process information management system.",English,
産業用エネルギー管理: 使用状況を追跡して効率を改善,https://www.dataparc.com/ja/blog/industrial-energy-management-track-usage-gain-efficiency/,産業用エネルギー管理,ダッシュボード＆ディスプレイ/データ可視化/プロセス製造,,,,Japanese,
製造業におけるデジタルツイン: 導入とその主なメリットについて,https://www.dataparc.com/ja/blog/digital-twin-manufacturing/,製造業におけるデジタル・ツイン,ダッシュボード＆ディスプレイ/データ可視化/プロセス製造/トラブルシューティング＆分析,,,,Japanese,
産業環境モニタリングの概要と方法,https://www.dataparc.com/ja/blog/what-is-industrial-environmental-monitoring/,産業環境モニタリング,ダッシュボード＆ディスプレイ/データ可視化/プロセス製造,,,,Japanese,
ESGデータ分析が製造業の常識を変える,https://www.dataparc.com/ja/blog/esg-data-analytics-game-changer/,ESGデータ分析,ダッシュボード＆ディスプレイ/データ可視化/プロセス製造,,,,Japanese,
제조업의 산업 에너지 모니터링,https://www.dataparc.com/blog/energy-management-manufacturing-monitoring-consumption/,산업 에너지 모니터링,프로세스 제조,프로세스 제조,,"제조업체는 낭비, 비용, 위험을 줄이기 위해 산업 에너지 모니터링이 필요합니다. 공장에 가장 적합한 솔루션을 찾는 방법과 고려해야 할 사항은 다음과 같습니다.",Korean,
산업 에너지 관리: 사용량 추적 및 효율성 향상,https://www.dataparc.com/ko/blog/industrial-energy-management-track-usage-gain-efficiency/,산업 에너지 관리,translate (ko)/공정 제조/대시보드 및 디스플레이/데이터 시각화,,,,Korean,
데이터 수집 및 시각화를 위한 세 가지 주요 PI System 대안,https://www.dataparc.com/ko/blog/top-pi-system-alternatives/,Pi 시스템 대안,translate (ko)/공정 제조/데이터 시각화/문제 해결 및 분석/히스토리안 데이터,,,,Korean,
제조 분야의 산업 에너지 모니터링,https://www.dataparc.com/ko/blog/energy-management-manufacturing-monitoring-consumption/,제조 분야의 에너지 관리,프로세스 제조/번역 (ko),공정 제조,,,Korean,
제조 효율성을 개선하는 4단계 방법,https://www.dataparc.com/ko/blog/improve-manufacturing-efficiency/,제조 효율성을 개선하는 방법,translate (ko)/공정 제조/대시보드 및 디스플레이/데이터 시각화/문제 해결 및 분석,,,,Korean,
Ensuring 21 CFR Part 11 Compliance with dataPARC Suite and Historian,https://www.dataparc.com/blog/21-cfr-par-11-compliance-dataparc/,21 CFR Part 11 Compliance,Process Manufacturing,,,Learn about 21 CFR Part 11 Compliance and how to implement it. Find out the answer to is dataPARC 21 CFR Part 11 Compliant.,English,
5 Effective Ways to Reduce Downtime in Manufacturing,https://www.dataparc.com/blog/5-effective-ways-to-reduce-downtime-in-manufacturing/,reduce downtime,Dashboards & Displays/Data Visualization/Process Manufacturing/Troubleshooting & Analysis,,,"Reducing downtime increases productivity, lowers costs, and decreases accidents. Downtime tracking software can be utilized to help reduce downtime. Knowing why the process is going down is key to reducing it.",English,
From Data Silos to AI: Ready Your Manufacturing Ecosystem for AI,https://www.dataparc.com/blog/how-to-ready-your-manufacturing-ecosystem/,data ecosystem for ai,Process Manufacturing/Troubleshooting & Analysis,,,"In this article, we will explore how manufacturers can ready their data ecosystem for AI (Artificial Intelligence) to make it successful.",English,
Upgrade Your Industrial Software: Best GE Proficy Replacement,https://www.dataparc.com/blog/upgrade-your-industrial-software-best-ge-proficy-replacement/,GE Proficy Replacement,Data Visualization/Historian Data/Process Manufacturing/Troubleshooting & Analysis,,,Explore the best GE Proficy replacement options tailored to your needs. Make an informed choice with our comprehensive guide.,English,
The Role and Importance of Big Data in Manufacturing,https://www.dataparc.com/blog/the-role-and-importance-of-big-data-in-manufacturing/,Big Data in Manufacturing,Historian Data/Process Manufacturing,,,"Discover how big data in manufacturing can enhance efficiency, optimize processes, and reduce costs with dataPARC.",English,
Boosting Workflow Efficiency: What to Add to Your Data Management Scorecard,https://www.dataparc.com/blog/workflow-productivity-index-what-to-add-to-your-data-management-scorecard/,Workflow Productivity Index,Data Visualization/Process Manufacturing,,,Explore Data Management Scorecard basics and how the Workflow Productivity Index can help you evaluate system efficiency.,English,
Understanding Digital Twin Platforms: Transforming Data into Actionable Insights,https://www.dataparc.com/blog/understanding-digital-twin-platforms-actionable-insights/,digital twin platforms,Data Visualization/Process Manufacturing,,,"Explore the benefits, applications, and future trends of digital twin platforms. Learn how they transform data into actionable insights.",English,
3 Top PI System Alternatives to Collect and Visualize Data,https://www.dataparc.com/blog/top-pi-system-alternatives/,Pi System Alternatives,Data Visualization/Historian Data/Process Manufacturing/Troubleshooting & Analysis,,,"Review the top PI System alternatives based on features, pricing, ease of use and more to choose the best option for your manufacturing plant.",English,
Importance of an Industrial Data Platform for Manufacturing Data,https://www.dataparc.com/blog/industrial-data-platform/,industrial data platforms,Process Manufacturing,Data Visualization/Process Manufacturing,,"Explore how Industrial Data Platforms revolutionize manufacturing data management, enhancing efficiency, innovation, and decision-making in the industry.",English,
OEE Data Collection Software: Reducing Waste and Increasing Efficiency,https://www.dataparc.com/blog/oee-data-collection-software-reduce-waste-increase-efficiency/,oee data collection software,Process Manufacturing,,,"Learn how OEE data collection software enhances efficiency, reduces waste, and boosts productivity in manufacturing. Start transforming your processes today.",English,
"Real-Time Manufacturing Dashboards: Setup, Importance, and Benefits",https://www.dataparc.com/blog/real-time-manufacturing-dashboard-setup-importance-benefits/,real time manufacturing dashboards,Dashboards & Displays/Data Visualization,,,Real-time-manufacturing dashboards provide a visual representation of processes and production so you can monitor KPIs in one central place.,English,
Digital Twins in Manufacturing Explained: Key Advantages and Implementation Insights,https://www.dataparc.com/blog/digital-twin-manufacturing/,digital twins in manufacturing,Dashboards & Displays/Data Visualization/Process Manufacturing/Troubleshooting & Analysis,,,"As a virtual model of your plant, digital twins in manufacturing allow you to continually monitor processes, capture data, and improve your efficiency.",English,
Manufacturing Process Optimization Strategies,https://www.dataparc.com/blog/manufacturing-process-opimization/,manufacturing process optimization,Dashboards & Displays/Data Visualization/Process Manufacturing/Troubleshooting & Analysis,,,"With the right measurement and analysis tools, you can increase output with these manufacturing process optimization strategies.",English,
How to Improve Manufacturing Efficiency in 4 Steps,https://www.dataparc.com/blog/improve-manufacturing-efficiency/,how to improve manufacturing efficiency,Dashboards & Displays/Data Visualization/Process Manufacturing/Troubleshooting & Analysis,,,"The first step in improving manufacturing efficiency is to create and enforce standard operating procedures, but there’s so much more you can do to improve.",English,
Industrial Energy Management: Track Usage and Gain Efficiency,https://www.dataparc.com/blog/industrial-energy-management-track-usage-gain-efficiency/,Industrial energy management,Dashboards & Displays/Data Visualization/Process Manufacturing,,,"For better industrial energy management, use manufacturing analytics data to identify areas where you can improve energy efficiency.",English,
What is Industrial Environmental Monitoring and How to Do It,https://www.dataparc.com/blog/what-is-industrial-environmental-monitoring/,industrial environmental monitoring,Dashboards & Displays/Data Visualization/Process Manufacturing,,,,English,
